{"contract":"ONSURE_VERIFIED_TO_DEPLOYED_RECEIPT_V2_CANDIDATE","receipt_id":"vtd-001","target_id":"target-001","verified_artifact_digest":"aaaaaaaaaaaaaaaaaaaaaaaaaaaaaaaaaaaaaaaaaaaaaaaaaaaaaaaaaaaaaaaa","deployment":{"deployment_id":"deploy-001","provider":"KUBERNETES","environment_id":"prod-a","expected_artifact_digest":"aaaaaaaaaaaaaaaaaaaaaaaaaaaaaaaaaaaaaaaaaaaaaaaaaaaaaaaaaaaaaaaa","deployment_receipt_sha256":"bbbbbbbbbbbbbbbbbbbbbbbbbbbbbbbbbbbbbbbbbbbbbbbbbbbbbbbbbbbbbbbb"},"readback":{"actual_artifact_digest":"aaaaaaaaaaaaaaaaaaaaaaaaaaaaaaaaaaaaaaaaaaaaaaaaaaaaaaaaaaaaaaaa","readback_method":"IMAGE_DIGEST_READBACK","readback_receipt_sha256":"cccccccccccccccccccccccccccccccccccccccccccccccccccccccccccccccc"},"environment":{"environment_digest":"dddddddddddddddddddddddddddddddddddddddddddddddddddddddddddddddd","policy_epoch":"policy-1","config_digest":"eeeeeeeeeeeeeeeeeeeeeeeeeeeeeeeeeeeeeeeeeeeeeeeeeeeeeeeeeeeeeeee"},"authority":{"principal_profile_sha256":"ffffffffffffffffffffffffffffffffffffffffffffffffffffffffffffffff","authority_epoch":"auth-1","purpose":"DEPLOYMENT_VERIFICATION"},"decision":"PASS","reason_codes":["VERIFIED_ARTIFACT_EQUALS_DEPLOYED_READBACK"],"created_at":"2026-08-11T14:00:00Z","signature":{"key_id":"deploy-key-001","algorithm":"Ed25519","signature":"aaaaaaaaaaaaaaaaaaaaaaaaaaaaaaaa"},"receipt_sha256":"1111111111111111111111111111111111111111111111111111111111111111"}
